,url_list,rate,title,author,description,genre,max_ep,like_tot_sum,subscribe,num_of_webtoon,total_pic_type,duration(day)
107,https://www.webtoons.com/en/romance/see-you-in-my-19th-life/list?title_no=1266,9.89,See You in My 19th Life,Lee Hey,"Jieum Ban has an extraordinary ability: she can remember the memories of all her past lives. After her previous life is cut short by a tragic accident, she sets out to reconnect with the people of her past life in her current one. Will memories of her 18th life sabotage romance in her 19th? Or will love endure across different lives?",Romance,41,4.4M,895.4K,1,2,805
108,https://www.webtoons.com/en/action/jungle-juice/list?title_no=2480,9.82,Jungle Juice,HYEONG EUN / JUDER,"Suchan Jang is an extraordinary college student at the top of the social food chain. But underneath the perfect facade, he hides a pair of insect wings that suddenly grew when he used a mysterious bug spray called ""Jungle Juice.” Suchan's life crumbles when he bares his wings to the world to save someone's life. When all hope seems lost, Suchan stumbles upon a hidden world of insect humans where everyone is accepted for what they are. But the law of the jungle governs this secret society and all must fend for themselves in order to survive.",Action,26,1.9M,693.5K,0,1,182
109,https://www.webtoons.com/en/romance/brass-and-sass/list?title_no=1652,9.7,Brass & Sass,antlerella," It may have been the music that attracted her to band class, but it was love that made her stay…even if she doesn't have any musical talent whatsoever.  But what high schooler Camilla lacks in ability, she makes up for in passion – especially when it comes to Victor, the handsome musician who’s caught her eye.  Will love rule the day, even when your crush-of-choice is a real brass-hole? Read on to find out!",Romance,91,4.9M,604.4K,0,5,2438
110,https://www.webtoons.com/en/thriller/shotgun-boy/list?title_no=2534,9.84,Shotgun Boy,Carnby Kim / Hongpil,"While running for his life in the woods, bullying victim Gyuhwan stumbles upon a shotgun and just enough shells for his classmates. It’s a recipe for disaster. But fate takes an unexpected turn when he returns to find his classmates under attack by brain-eating creatures. Now, the only thing that stands in the way of their ravenous feast is a boy with a shotgun.",Thriller,22,1.2M,537.4K,0,1,163
111,https://www.webtoons.com/en/action/weakhero/list?title_no=1726,9.85,Weak Hero,SEOPASS / RAZEN,"Once the bullies target you, it’s game over. The school is run by tyrants whose favorite hobby is tormenting the weakest kids in class. But then Gray arrived. This mysterious new student threatens to dismantle the established order. He may be small in stature, but his calculative and brutal fighting leaves unsuspecting opponents lying on the floor begging for mercy. Now the school's toughest bullies have to scramble to take down this new and unusual hero.",Action,146,9.2M,1M,0,1,374
112,https://www.webtoons.com/en/romance/act-like-you-love-me/list?title_no=2521,9.77,Act Like You Love Me!,XUANN,"25-year-old Ji-eon is stressed, overworked, and penniless. When a mix-up at a temp job has her spending a day as famous actor Doyun Nam’s personal assistant, she takes her anger out on a doll... which turns out to have the magical ability to control him at her every whim. Now it’s her turn to be the boss.
",Romance,23,1.8M,588K,1,2,476
113,https://www.webtoons.com/en/fantasy/the-witch-and-the-bull/list?title_no=1892,9.78,The Witch and The Bull,Moonsia,"Tan's job as the King's royal advisor has nothing to do with his hatred for witches, but it does make him a prime target for a curse that turns him into a BULL! The only way to undo this hex is to rely on the beautiful witch, Aro. Can her kindness turn his feelings around, and break this spell?",Fantasy,68,4.9M,791.5K,0,2,518
114,https://www.webtoons.com/en/horror/survive-romance/list?title_no=2607,9.81,Surviving Romance,Lee Yone,"When Chaerin Eun becomes the protagonist of the romance novel she is reading, she expects a fairytale ending with the novel’s love interest, Jeha. But when a bizarre twist makes her realize the story is not playing out as it does in the book, she’ll need the help of an unlikely character from her class to defy the new storyline and find her happy ending -- if only she can figure out who this ‘Unknown Extra’ is first!",Horror,18,"746,829",323.7K,1,2,868
115,https://www.webtoons.com/en/romance/shadow-bride/list?title_no=2618,9.72,Shadow Bride,Sae In Lee / Soo Bean Lim,"Yunjo is a young prince who has always served his kingdom from behind the scenes. He’s spent his whole life in the shadow of his brother, the crown prince Yigang, fighting enemies and winning wars in his name. All that changes when one day, he meets Seolyun, a mysterious and charming woman who captivates him instantly. What happens when a man emerges from the shadows to follow his heart? Can he overcome all of the obstacles in his way to step into the light and be with the one he loves?",Romance,19,"601,944",316.1K,0,2,651
116,https://www.webtoons.com/en/romance/she-would-never-know/list?title_no=2508,9.07,She Would Never Know,Cafelatte / JINHA,"Gentle in demeanor yet fiercely independent and competent, Songa is a top assistant brand manager at Klar Cosmetics who gets things done with a smile. Thriving in life, she is suddenly caught off guard by her charming junior colleague’s enigmatic warning, “Don’t put on that lipstick.” Then an unexpected revelation changes everything.


",Romance,25,"840,004",350.6K,0,2,2589
117,https://www.webtoons.com/en/mystery/parallelcity/list?title_no=2053,9.84,Parallel City,Goda,"Can two people look exactly alike? Fear sweeps the city as people report seeing their own doubles. Then the disappearances start. Mere coincidence? Or are the mysterious twins harbingers of bad luck? Whatever they are, if you spot one, you better think fast!",Mystery,61,2M,386.9K,0,1,497
118,https://www.webtoons.com/en/thriller/escape-room/list?title_no=1815,9.65,Escape Room,10PARK,"Overly rational. Sociopathic, even. Sean's unfeeling personality consistently drives people away from him. That is, until he wakes up after a night of heavy drinking in... an escape room? Now he must use his unique mind and join hands with other players to survive sadistic games of life and death. The only way out is to escape!",Thriller,65,1.6M,371.6K,0,1,147
119,https://www.webtoons.com/en/slice-of-life/carl/list?title_no=1216,9.77,CARL,Hussein Traboulsi / Claudia Z.,Carl is a robot psychiatrist that suddenly becomes sentient. He starts longing to be human but his creator and father figure Dr Alda prevents him from showing his feelings out of fear of losing him. More challenges arise when Alda’s arch nemesis sets out to destroy them both.,Slice of life,158,3.8M,378K,0,3,2589
120,https://www.webtoons.com/en/drama/pyramid-game/list?title_no=2277,9.53,Pyramid Game,Dalgonyak,"Every Thursday afternoon, once a month, students at Love High cast their votes in a popularity poll. The result? A brutal ranking system that determines the entire social hierarchy of the school. After starting at the bottom, can new transfer student Suji make her way to the top of the pyramid? Or will she topple the game altogether?
",Drama,26,"597,419",170.7K,0,2,1014
121,https://www.webtoons.com/en/romance/kind-of-confidential/list?title_no=663,9.3,Kind of Confidential,Vivian Darlin,"When the nation’s most popular hero falls from the sky, he is saved by a totally normal girl. The strange incident turns both their lives upside down and leaves them with countless questions. What caused the accident? Why does it feel like they’ve met before? How are commoner noodles so delicious? And… um… can a hero and a villain fall in love? (Asking for a friend.)",Romance,116,4.2M,918.1K,0,3,2591
122,https://www.webtoons.com/en/comedy/just-pancakes/list?title_no=1651,9.66,Just Pancakes,HadeToons,"Wetzel, Shelby, and Ebus may be brothers, but that doesn't mean they understand each other -- or women. Follow their wacky shenanigans as these three eccentric wizards try to run a struggling tavern on Hero's Road, file their taxes, and refill the pickle jar. Laugh so hard your lungs punch your eyeballs! Learn more about cooking than you ever wanted to know! Realize you're probably going to hell for laughing at this!",Comedy,161,2M,195.7K,0,3,2415
123,https://www.webtoons.com/en/horror/beetle-hands/list?title_no=2247,9.68,Beetle Hands,Herhumanist,"Welcome to the Heartland, a nightmarish realm where your own memories come back to hunt you -- literally. Dragged into the Heartland by the terrifying Beast that lives inside it, Matthew must survive long enough to free himself and his best friend Kenma before the Beast consumes them both. Better run fast, Matthew, before the Beast can catch you.",Horror,35,"235,681",105K,0,1,518
124,https://www.webtoons.com/en/fantasy/rob/list?title_no=2479,8.81,ROB,Richard Dinnick / Magda Price & Miguel Sepulveda,"When war threatens to destroy his nation’s entire way of life, a young squire named Rob knows just the thing to do: steal a weapon from the Timeless Armory. The only thing standing between him and victory is thousands of miles, sinister knights, crooked elites and enemy assassins. Will he make it back in time to stop the invaders, or will he be vanquished along the way?",Fantasy,28,"58,711",56.1K,0,4,140
125,https://www.webtoons.com/en/super-hero/unordinary/list?title_no=679,9.76,unOrdinary,uru-chan,"Nobody paid much attention to John – just a normal teenager at a high school where the social elite happen to possess unthinkable powers and abilities. But John’s got a secret past that threatens to bring down the school’s whole social order – and much more. Fulfilling his destiny won’t be easy though, because there are battles, frenemies and deadly conspiracies around every corner.",Superhero,246,43.8M,5.1M,0,1,217
126,https://www.webtoons.com/en/sf/city-of-blank/list?title_no=1895,9.7,City of Blank,66,"In a world where ghostly Blanks can steal your face – and your life – at any moment, a young boy named Rex hunts for his brother’s killer. Cursed with the unique power to physically touch Blanks, Rex starts to uncover darker secrets at the city’s center and in his own past. Will Rex unmask the killer, or will he become just another faceless victim in the City of Blank?",Sci-fi,67,2.9M,535.2K,0,3,843
127,https://www.webtoons.com/en/supernatural/simon-sues/list?title_no=1619,9.15,Simon Sues,Myung Hee,"​Simon was a shining star in law school, but instead of joining a traditional practice with mortal stakes, he’s about to be thrown into a world of unspeakable courtroom evil.  Now, all that stands between peace on Earth and the fall of mankind is Simon’s unique law practice – where demons stand trial and this hungry young attorney sends them back to hell.",Supernatural,81,"485,528",152.3K,0,1,2408
128,https://www.webtoons.com/en/romance/antistalker/list?title_no=2087,9.72,AntiSTALKER,VOKIVORMOK,"At this school usual students study with vampires from wealthy families. She is a representative from disciplinary committee, he is a guy who breaks school rules. She is a hunter, he is a target. He is her stalker, she is his target.",Romance,52,2.7M,552.5K,0,3,819
129,https://www.webtoons.com/en/sf/space-boy/list?title_no=400,9.84,Space Boy,Stephen McCranie,"A girl who belongs in a different time. A boy possessed by an emptiness as deep as space. A story about an alien artifact, a mysterious murder, and a love that crosses light years.",Sci-fi,290,6.1M,409.3K,0,3,112
130,https://www.webtoons.com/en/comedy/my-dictator-boyfriend/list?title_no=1391,9.04,My Dictator Boyfriend,Teo / Guy,Manny just took the reins of a nation. But who will take the reins of his heart?,Comedy,297,4.3M,263.8K,0,3,105
131,https://www.webtoons.com/en/supernatural/the-red-king/list?title_no=1687,9.76,The Red King,Heylenne,"Being young, rich and handsome doesn’t always bring you happiness. Just ask Ivan, the black sheep of his family. If he wasn’t busy drinking, partying and being a royal screw up, he could be building a career in his father’s vast business. As if Ivan’s volatile family dynamics couldn't get any worse, he accidentally helps a supernatural entity steal a secret that could sink his father’s entire corporate empire.",Supernatural,57,2.5M,799.9K,0,1,1815
132,https://www.webtoons.com/en/romance/unlovable-replacement/list?title_no=1762,9.79,Unlovable Replacement,Nylana,"When his relationship went down the drain, Chiko Dyer started to develop a weird relationship with a local delivery girl. ",Romance,49,5.7M,1.4M,0,2,770
133,https://www.webtoons.com/en/supernatural/lalins-curse/list?title_no=1601,9.87,Lalin's Curse,Isakytm,"David is what the supernatural crowd likes to call a “true believer,” a badge the teen wears proudly as he searches for the existence of all things scary and mysterious. When David, alongside his skeptical best friend Felix, are presented with proof that something terrifying may have landed right on their doorstep, the hunt for the Curse of Lalin is on - and life will never be the same again.",Supernatural,46,3M,778.5K,0,1,616
134,https://www.webtoons.com/en/fantasy/suitor-armor/list?title_no=2159,9.74,Suitor Armor,Purpah,"Lady-in-waiting, Lucia believes getting through the royal wedding will be the toughest part of her new life. That is until she finds herself falling head over heels with Modeus, an up-and-coming knight to the king's guard. With her newfound interest, she is quickly awakened to the mysteries of the kingdom when she learns Modeus is in fact an enchanted suit of armor without a soul. Could there be more to him than just shining armor? ",Fantasy,45,4.4M,1M,0,1,112
135,https://www.webtoons.com/en/drama/i-love-yoo/list?title_no=986,9.78,I Love Yoo,Quimchee,"Dogged by pain and misfortune from the very beginning, Shin-Ae decides she wants nothing to do with people nor anything to do with romance. Although content with her unsocial, boring, loveless existence, her lifestyle is challenged after she ruins an unsuspecting strangers' clothes.",Drama,153,28.2M,4.3M,0,2,1134
136,https://www.webtoons.com/en/action/the-god-of-high-school/list?title_no=66,9.7,The God of High School,Yongje Park,"Mori Jin is a high school student and Taekwondo specialist who enters ""The God of High School,"" a fighting tournament that promises the winner anything they want. What began as a  competition to seek out the best high school fighter soon reveals itself to be part of a much greater plot that goes beyond Mori's wildest imagination. What will he give to become a true god?",Action,526,24.5M,2.3M,0,1,2588
137,https://www.webtoons.com/en/supernatural/muted/list?title_no=1566,9.71,Muted,Miranda Mundt,"On the full moon of her 21st year, the young witch, Camille Severin, is expected to perform the traditional ritual to summon forth a winged demon for her families success and prosperity. But when the ritual goes wrong, it reveals the terrifying truths about herself and the secrets that threaten to tear her family apart. ",Supernatural,94,5.3M,715.9K,0,5,1201
138,https://www.webtoons.com/en/action/hardcore-leveling-warrior/list?title_no=1221,9.76,Hardcore Leveling Warrior,Sehoon Kim,"Known as Hardcore Leveling Warrior, Ethan is the #1 player of the world's biggest game, Lucid Adventure. But when a mysterious player kills Ethan and forces his character back to level 1, he will do anything to get back on top. New friends and old foes, as well as mysterious forces and his own dark past, will follow him as he does his best to take back what was once his.",Action,287,13.2M,1.2M,0,3,245
139,https://www.webtoons.com/en/action/the-gamer/list?title_no=88,9.62,The Gamer,Sangyoung Seong / Sang-A,"Jihan Han is your typical high school student -- minus the fact the he’s acquired the special ability to view the world around him as a video-game. Not long after this discovery, he stumbles upon a hidden world filled with others just like him. Now, amidst juggling homework and completing quests, Jihan must learn how to navigate his newfound power in order to level up in life.",Action,365,16.1M,1.8M,0,1,84
140,https://www.webtoons.com/en/romance/dating-with-a-tail/list?title_no=1263,9.54,Dating With a Tail,Jinha / Hepon,"On the dawn of her 29th birthday, unlucky-in-love Yunha discovers a shocking family secret: she’s started growing a fox tail, the mark of an ancestral curse. She must find her fated love before her 30th birthday or she is destined to become a fox forever! Even with her new-found enchanting power to attract men using her scent, will one year be enough to break the curse before it’s too late?",Romance,40,2.2M,526K,0,2,2321
141,https://www.webtoons.com/en/romance/secret-playlist/list?title_no=2395,9.66,Secret Playlist,2F,"Hanju is your ordinary university student… except for the fact that she’s also the up-and-coming Metube cover artist, PLII. When popular boy group member Levi takes notice of PLII and requests to collaborate, Hanju will do anything to hide her secret identity. But as the two grow closer working on a class project, Hanju’s cover begins to unravel. Will Levi discover her secret?",Romance,34,1.9M,542.2K,0,2,168
142,https://www.webtoons.com/en/romance/brimstone-and-roses/list?title_no=1758,9.44,Brimstone and Roses,Mei Rothschild,"Bea is over her ex. Absolutely, completely, over her... except that she's not. When Bea finds out that her ex is also attending her sister's wedding, Bea does what any logical person would do and summons an incredibly hot, sarcastic demon to be her date. But demons are tricky, and now hers won't leave her alone.",Romance,74,2.8M,459.3K,0,5,322
143,https://www.webtoons.com/en/drama/lost-in-translation/list?title_no=1882,9.71,Lost in Translation,Jjolee,"The up-and-coming K-pop group Mayhem is steadily climbing the charts, but fame doesn't come for free. Bad Boy front man of the group Wyld knows this all too well. Forced to take on a controversial persona behind his fellow members' backs to help keep the momentum going, can Wyld keep sight of himself beneath all the lies and scandals? Or will he become his own false persona?",Drama,77,4.2M,569K,0,2,147
144,https://www.webtoons.com/en/drama/back-to-you/list?title_no=2113,9.72,Back to You,Honey B,"What if an unexpected accident suddenly transported you back to ten years ago? For Hayoung, suddenly traveling back in time to high school means the opportunity to save the life of Jaehyun, the one person she's always loved... Will she be able to change both of their fates?",Drama,57,2.8M,636.3K,1,2,112
145,https://www.webtoons.com/en/drama/mom-im-sorry/list?title_no=2049,9.72,"Mom, I'm Sorry",MiTi / GUGU,"“Mom, I’m sorry. Please don’t die.” When Henry realizes death is at his mother’s doorstep, he strikes a deal with a lifespan dealer to give years of his own life to his ailing mother. Now, his mother is a 20-year-old college student with a full life ahead of her, and Henry devotes his remaining days to helping her live life to the fullest. But things turn complicated when his friend falls in love with her!",Drama,62,3.6M,753.7K,0,2,616
146,https://www.webtoons.com/en/sports/no-scope/list?title_no=1572,9.77,No Scope,ZOYANG,"PSI BOND: it’s the hottest online game in the world. Self-confident high schooler Suho Kang is a Grand Master, a title only the top 1% of players can achieve. He decides to take clueless Doyoon Lee, a loner who may or may not be a gaming genius, under his wing. Join them on the battlefield of PSI BOND, where high-speed connections and high school will never be the same again.",Sports,118,4.1M,633.4K,0,1,259
147,https://www.webtoons.com/en/comedy/andy-bass/list?title_no=2284,9.37,Andy Bass,KenneDuck / Gia,"Andy Bass is just like any other high school sophomore. She has to deal with maintaining grades, having an arch-nemesis, falling for a cute transfer student, and most importantly, being a vertical mermaid! (Totally normal, right?) Andy is the most hideous creature alive, and she still has to attend public school!",Comedy,43,"913,920",155.9K,0,3,343
148,https://www.webtoons.com/en/fantasy/hooves-of-death/list?title_no=1535,9.45,Hooves of Death,Sam Bragg,"Read Hooves of Death now on Webtoon! It’s the end of the world, and humanity is on its last legs against the zombie horde.  Now, all that stands between mankind and total extinction are Commander Sprinkles, Blaze, Sergeant Glitter and a handful of other fierce warriors.  Mythical creatures with supernatural powers and incredible determination, they have sworn to protect the human race. Yes, they are unicorns – but they are also our last hope.",Fantasy,107,2.1M,304.2K,0,3,434
149,https://www.webtoons.com/en/action/microhunter/list?title_no=2320,9.56,microHUNTER,B.Y / JRobin,"While out to get his sister’s favorite snack, Baekhyeon finds himself and the people around him suddenly shrinking... to the size of ants! Now, everything from cats to robotic vacuums pose a threat to human survival. Within this chaos, everyone is given a gift -- a unique superpower and interface that lets them see data about themselves. Though it’s become a dark and desperate world, Baekhyeon must put his ability and wits to the test to make it out alive and save his sister.",Action,81,2.3M,324.1K,0,1,798
150,https://www.webtoons.com/en/fantasy/raven-saga/list?title_no=2527,9.73,Raven Saga,Chihiro Howe,"Secluded deep within the forest, Wen has never experienced life outside her cottage home. Alongside her over-protective grandmother, they both live under a protective seal that had kept them unseen from the rest of the world. Every day she is told to remain safe and to never go beyond the woods past the stone markers. However, curiosity takes hold of her as she longs to experience the vast outside world for herself. But little did she know the real mystery and danger that lies behind her doorstep. ",Fantasy,23,"655,310",169.5K,0,2,749
151,https://www.webtoons.com/en/romance/little-rain/list?title_no=2612,9.84,Little Rain,Mai,"A Guardian Angel without his memory ends up in a cats body. Lisa is a down on her luck, whose life has always been tinged with misfortune. Fortunately her cat, Rain, is always there for her when she needs him. But little does she know, Rain has a big secret. His memories may be missing, but Rain remembers this... He'd do anything to protect Lisa.",Romance,17,"483,722",279.9K,0,2,427
152,https://www.webtoons.com/en/action/gul/list?title_no=2617,9.49,Gul,Atenmaru / NicolieDC,"A rowdy, young, and ambitious Orc named Gul is great at three things: running, running fast, and running away. But when one misadventure brings him face to face with Wran, a mysterious Dark Elf, fate hands Gul a mission that no one else in his village could keep pace with.",Action,17,"228,036",130.3K,0,3,203
153,https://www.webtoons.com/en/fantasy/newman/list?title_no=405,9.73,Newman,Josh Ulrich,"This isn't your average workplace relationship. It's not every day you fall for a girl who accidentally turns you into her love slave, but that's not half as scary as meeting her mother. Oh, and did we mention the monsters? There's lots of those.
",Fantasy,272,2.5M,192.4K,1,3,98
154,https://www.webtoons.com/en/fantasy/four-leaf/list?title_no=1454,9.72,Four Leaf,Lumaga,"Lupe hasn’t been able to adapt very well to the new school… though she hasn’t really been able to adapt to anything ever. Four Leaf is a story about a bunch of dangerous magical girls, but most specially about one not-at-all-magical girl.",Fantasy,111,1.6M,229.7K,0,3,1671
155,https://www.webtoons.com/en/fantasy/athena-complex/list?title_no=867,9.55,Athena Complex,Kaisar,"Suffering from heartbreak after being rejected by Poseidon, goddess of wisdom Athena becomes human to seek revenge... but as a high school boy. There she plots to befriend Poseidon’s reincarnation, Adrian, who doesn’t have the slightest clue about the world of gods. But will her sweet vengeance be thwarted by other opposing forces, or will her own one-sided love hinder her plans?",Fantasy,132,2.7M,519.3K,0,2,196
156,https://www.webtoons.com/en/drama/beyond-virtual/list?title_no=2504,9.19,Beyond Virtual,EGA,"High schooler Sora Yeom has the perfect life: she lives in a beautiful house, wears the latest fashion, and even goes on dates with her favorite idol member. There’s just one catch -- none of it is real! Sora lives out her fantasy life in VR, making reality feel boring by comparison. With the help of her best friend Yiheon, who dreams of being a real-life idol, Sora must find her place in a world where most people would rather escape into VR than face reality.
",Drama,17,"242,058",150.6K,0,2,1361
157,https://www.webtoons.com/en/horror/distant-sky/list?title_no=75,9.57,Distant Sky,Inwan Youn / Sunhee Kim,"""Am I the only one still alive?"" A boy wakes up to find himself in a building full of dead people, and Gangnam is shrouded in complete darkness. No cars, no electricity and no stars in the sky… Not only Gangnam but the entire city seems deserted.",Horror,76,"962,296",306.1K,1,1,1428
158,https://www.webtoons.com/en/fantasy/thornstone/list?title_no=1612,9.06,Thornstone,Vicente Miranda,"Powerful and headstrong, Iris is a young girl who commands magical powers that most of us would only dream about. But if her grandfather has his way, those mystical skills will be used to do little more than maintain a successful goldsmith shop in their tiny village.  However, when war approaches their doorstop, Iris knows it is her destiny to help join the cause, and satisfy her urge to accomplish great things with her considerable gifts.",Fantasy,100,"488,331",76.9K,0,3,315
