,url_list,rate,title,author,description,genre,max_ep,like_tot_sum,subscribe,num_of_webtoon,total_pic_type,duration(day)
54,https://www.webtoons.com/en/sf/it-was-all-you/list?title_no=2675,9.53,It Was All You,I SOON KI / OH5HO,"In a near-future Pyeongyang, clones have become an indispensable part of human life. Tasked to test XYZ Corporation’s latest prototype, biomedical engineer Dr. Yuri Lee is marveled by LPC-6, a physically perfect and intellectually superior clone designed for a single purpose -- to give unconditional love to his master. As she uncovers the depths of her unfaithful husband’s depravity, she finds solace in “Victor” and his extraordinary capacity for empathy. Will her desire for retribution and love set her onto a path of no return?",Sci-fi,16,"349,167",193K,0,2,602
55,https://www.webtoons.com/en/mystery/the-wolfman-of-wulvershire/list?title_no=1784,9.58,The Wolfman of Wulvershire,K. Oliver,"Lady Carina would rather be single forever than become any man’s baby-factory. So when she shows up at the Duke of Wulvershire's annual Spring Fling wine and dine, it’s a shock to everyone — but not more shocking than the ensuing series of murders! Will Carina make it out alive, and, more importantly, will she find herself a hunky husband?",Mystery,57,1.3M,335.7K,0,2,112
56,https://www.webtoons.com/en/comedy/the-hip-guy/list?title_no=2577,9.13,The Hip Guy,HENIE,"27-year-old Ga-eun Seong has everything that money can buy, but she can’t rest until her athleisure company is the best in the industry. That’s why she hires Chan Gwak to model her new leggings line for men. Chan has the perfect butt, but is it perfect enough to meet Ga-eun's high standards? After social media interactions have people thinking they’re dating, Ga-eun begins to question... even though Chan’s not her type, could she end up falling for him anyway?",Comedy,19,"492,350",202.9K,0,2,476
57,https://www.webtoons.com/en/romance/my-roommate-is-a-gumiho/list?title_no=2611,9.62,My Roommate is a Gumiho,NA,"Under normal circumstances, 24-year-old Dam Lee wouldn’t move in with a random guy who she just met, much less a 900-year-old one. But these aren’t normal circumstances: she accidentally swallowed the bead of a gumiho (a nine-tailed fox from Korean mythology) named Wuyeo Shin, and if they don’t find a way to extract the bead from her body within a year, she’ll die and he’ll never become human. Can Dam and Wuyeo find a way to remove the bead from Dam’s body before it’s too late? And will Dam ever find love, especially when her unusual circumstances restrict her dating options?",Romance,35,"807,095",248.1K,0,2,1043
58,https://www.webtoons.com/en/horror/stagtown/list?title_no=2532,9.79,Stagtown,Punko,"Something is wrong with the town Frankie grew up in. Hidden away from the world on the other side of an old stone bridge, the people of Stagtown spend every day trying not to see the strange things that go on around them. From the creator of Tokyopop's best-selling OEM series comes the spiritual successor to Bizenghast.",Horror,24,"765,025",158.3K,0,3,322
59,https://www.webtoons.com/en/slice-of-life/small-world/list?title_no=1159,9.53,Small World,Wonsun Jin,What do you do when you're having a bad day? Need a hug? Or just a laugh? Call your boyfriend of course! Follow along with Robin and Julien as they navigate in their own small world.,Slice of life,607,17.6M,832.2K,0,3,511
60,https://www.webtoons.com/en/fantasy/nothing-special/list?title_no=1188,9.6,Nothing Special,Katie Cook,"Callie thinks that in the grand scheme of the worlds at large, she's nothing special. With the unexpected addition of friendship and adventure into her life, she's about to find out that she was very, very wrong.",Fantasy,146,2.7M,402.4K,0,3,413
61,https://www.webtoons.com/en/drama/da-yomanville-gang/list?title_no=1578,9.23,Da Yomanville Gang,Jason King,"Layla just wants a new, quiet start in Yomanville. However, along with the relocation, comes new faces... and new feelings for her. Good thing she's confident and great under pressure--oh wait, that's not right. - Who wrote this synopsis?! - Anyway, join Layla, Dylan, Sally, Marv and Joe, as well as some rather unsavoury characters, in Da Yomanville Gang!",Drama,115,1.7M,235.3K,0,5,546
62,https://www.webtoons.com/en/fantasy/zero-game/list?title_no=1704,9.73,Zero Game,zelbasen,"After the death of her parents, Hanna Yoo sees her life tumble out of control, until one day a mysterious email invites her to compete in Zero Game, where losing means death, but winning brings a big reward: the ability to reset your entire life and live it over again…this time without all the pain and suffering. In Zero Game, Hanna faces danger everywhere. But who can she trust? And how is her deceased father involved? Rivals beware: she may seem like a noob…but inside Zero Game, you underestimate Hanna Yoo at your own risk.",Fantasy,101,2.1M,507.2K,0,2,112
63,https://www.webtoons.com/en/thriller/the-saviors-time/list?title_no=2608,9.56,The Savior's Time,Song Geukjang,"When the youngest sister of the Yu family ends her own life, her elder brother begins to investigate her untimely death. The only clue left behind is the record of her messages on Savior -- a mysterious online community for those who need salvation from reality.
",Thriller,19,"199,755",122.8K,0,2,1675
64,https://www.webtoons.com/en/super-hero/lavender-jack/list?title_no=1410,9.53,Lavender Jack,Dan Schkade,"The dawn of the 20th century! The City of Gallery is a place of science, diversity, and wealth… but it's also held in the clutches of a corrupt ruling class that’s squeezing it for all it's worth. Enter: LAVENDER JACK — a devilish vigilante whose fighting prowess and advanced technology make him a nightmare for Gallery’s elites. But they’re not about to loosen their grip on the city without a fight. They’ve got some devils of their own, you see...",Superhero,102,"550,412",109.4K,0,3,1085
65,https://www.webtoons.com/en/action/pound/list?title_no=1496,9.16,Pound,Tony Karnowski / Orlando Caicedo,"Welcome to the World Fighting League – a violent pastime popular with sports fans who have grown bored with the predictability of baseball, basketball and even football (!).  Imagine the most brutal fighters in the world each sporting destructive superpowers, and overseen by an ethically questionable enterprise that values profit over fighter safety.   The fighters put their lives on the line for fame and fortune – the audience laps it up – and the dark side gets even richer.  It’s a dirty business that works…that is until a young warrior comes along who’s fighting to save the life of his brother – and is willing to bring down the system to do it.",Action,86,"321,360",91.4K,0,1,98
66,https://www.webtoons.com/en/super-hero/supersonic-girl/list?title_no=633,9.12,Supersonic Girl,Sandra Diaz,"Sonia Rockwell is a teenager from Radio City, who will have to face her high school daily life while she fights against the supervillains who attack the city. Join the adventures of this supersonic girl!",Superhero,72,"620,248",207.1K,0,3,52
67,https://www.webtoons.com/en/fantasy/little-matcha-girl/list?title_no=1665,9.77,Little Matcha Girl,mame ´･ω･`,"Poor Matilda. All she wants out of life is to be a RuneTube star – sharing her escapades with fellow adventurers from around the world. But when you’re the granddaughter of a killer mafia boss, and necromancy is a family tradition, your life plans have a tendency to go awry.",Fantasy,57,1.2M,319.8K,0,2,711
68,https://www.webtoons.com/en/comedy/boyfriend-of-the-dead/list?title_no=1102,9.74,Boyfriend of the Dead,Ushio,"She’s a smart, independent young woman who’s kicking ass and struggling to make her way through the middle of the zombie apocalypse. Just her luck: one day she goes out searching for food and shelter and ends up finding a boyfriend instead. And, oh yeah, because modern love isn’t hard enough…he’s UNDEAD!",Comedy,358,27.2M,2M,0,1,952
69,https://www.webtoons.com/en/fantasy/skye/list?title_no=2234,9.64,Skye,Cynthia J.S.,"In a world where magic meets technology, an exceptional engineer comes across an unusual find. What was meant to be a simple trip to the junkyard has lead Skye to discovering a fully functioning robot! But while trying to help the robot find her original owner; secrets begin to unravel and Skye learns the truth behind her clouded past.",Fantasy,28,"372,122",175.7K,0,2,700
70,https://www.webtoons.com/en/fantasy/watermelon/list?title_no=1435,9.8,Watermelon,Rorita,"Orphaned at a young age, two stray cat siblings struggle through life to find their place in this world. Through a series of unfortunate circumstances, each sibling must eventually find their own path.",Fantasy,122,5.2M,716K,0,3,413
71,https://www.webtoons.com/en/fantasy/luggage/list?title_no=1642,8.38,Luggage,zealforart,"What do you value most? And if it was taken from you, what would you do to get it back? Join four strangers as they are transported to the mythical land of Luggage – and set out on a quest to locate lost items of great personal value. Along the way, they must make hard decisions about what’s important to them, and what must be left behind in order to retrieve what has been lost.",Fantasy,31,"234,332",76K,1,4,1715
72,https://www.webtoons.com/en/romance/truebeauty/list?title_no=1436,9.61,True Beauty,Yaongyi,"After binge-watching beauty videos online, a shy comic book fan masters the art of makeup and sees her social standing skyrocket as she becomes her school’s prettiest pretty girl overnight. But will her elite status be short-lived? How long can she keep her real self a secret? And what about that cute boy who knows her secret?",Romance,158,38.7M,6.3M,0,2,182
73,https://www.webtoons.com/en/romance/age-matters/list?title_no=1364,9.8,Age Matters,Enjelicious,"She’s a hopeless romantic who’s turning 30 – and is not super happy about it. He’s a reclusive billionaire who’s hired her to be his assistant – and he’s not too happy about that either. Together they rewrite the rules of friendship, love, work and the BEST way to clean someone’s apartment.",Romance,149,24.2M,3.3M,0,2,763
74,https://www.webtoons.com/en/action/omniscient-reader/list?title_no=2154,9.9,Omniscient Reader,sing N song / UMI,"Dokja was an average office worker whose sole interest was reading his favorite web novel 'Three Ways to Survive the Apocalypse.' But when the novel suddenly becomes reality, he is the only person who knows how the world will end. Armed with this realization, Dokja uses his understanding to change the course of the story, and the world, as he knows it.",Action,59,7M,1.4M,0,1,196
75,https://www.webtoons.com/en/romance/phase/list?title_no=2117,9.57,Phase,Jouki,"Min is unique. Plagued by debts, misfortune and a troubled past her life has been anything but normal. When she has the opportunity to earn a great deal of money, 50 million dollars to be exact,  she would be a fool to refuse. Despite the odd conditions she takes a chance with Shuu, the handsome, irritating billionare who can change her life. Can she keep her secrets close to her chest or will she ruin them both?",Romance,55,3.8M,869.9K,0,2,1246
76,https://www.webtoons.com/en/romance/love-me-knot/list?title_no=2224,9.37,Love Me Knot,Sophia,"You'd think that being able to see the Red String of Fate would make finding your soulmate a lot easier. But for Avery, the blossoming romance​ around her only emphasizes her own string... with no one attached to the other end. Is Avery destined to live a loveless life, or can she tailor her own romance?",Romance,48,3.4M,828.5K,0,2,283
77,https://www.webtoons.com/en/romance/swimming-lessons-for-a-mermaid/list?title_no=1912,9.73,Swimming Lessons for a Mermaid,YONGCHAN,"Choa is a mermaid who can't swim! Discouraged, she trades the ocean for a pair of human legs. But when the star of the high school swim team finds out her secret, he offers her the chance to prove her family wrong: free swimming lessons for a mermaid!",Romance,77,4.7M,694.8K,0,2,623
78,https://www.webtoons.com/en/comedy/everywhere-and-nowhere/list?title_no=1598,9.62,Everywhere & Nowhere,Merryweather / PeaCH,"Based on two of Shakespeare’s most beloved supporting characters, Everywhere and Nowhere follows the time travelling adventures of best friends Anne Guildenstern and William Rosencrantz, as they explore, fight and flirt their way through history. Their first stop is Ancient Greece, where the pair find themselves at the right hand of a very charismatic Greek leader loved by men and women alike, who also may just be bringing his people to the brink of war.  ",Comedy,173,8.9M,749.4K,0,2,1018
79,https://www.webtoons.com/en/slice-of-life/bluechair/list?title_no=199,9.72,Bluechair,Shen,The internet's favorite visual stand-up comic to make memes out of.,Slice of life,934,36.7M,1.2M,0,3,52
80,https://www.webtoons.com/en/romance/the-prince-of-southland/list?title_no=2522,9.64,The Prince of Southland,Chris Geroux,"Donnie Ali's shiny reputation is soiled the night he kissed an android, for romantic relationships with droids are deemed too dangerous and forbidden. But after his press release, another potential scandal emerges when he saves Jensen, a man on the run from an unknown assailant. Now living under the same roof, and paparazzi on every corner, could this romance be even more disastrous than his first?",Romance,25,"632,141",217.2K,0,5,1080
81,https://www.webtoons.com/en/sf/rebirth/list?title_no=1412,9.75,Rebirth,Michi,What would you do if you were given a second chance to turn back time and relive your past? Would you do what you did back then for fear of the butterfly effect? Or would you take a different course of action and let the future speak for itself?,Sci-fi,129,6.7M,1M,0,1,476
82,https://www.webtoons.com/en/action/neon-revenge/list?title_no=2510,9.69,Neon Revenge,Gisong / NemGa,"No one would have ever guessed that nerdy-looking Seongbin Cha is actually Neon Mask, the internet hero popular for punishing violent, bullying teens on ViewTube. He won’t rest until he eradicates every last delinquent in the country. Can he stomp them all out with the help of his bodyguards, or will they come back stronger than ever?

",Action,25,"839,392",257.6K,0,1,413
83,https://www.webtoons.com/en/romance/the-girl-downstairs/list?title_no=1809,9.61,The Girl Downstairs,Songah Min,"When Joon moves into his new apartment on his first day of college, he wasn't expecting beautiful ex-celebrity Duna to be living downstairs. Joon tries to avoid her at first, but finds himself growing more and more curious about her mysterious life.",Romance,93,2.8M,523K,1,2,938
84,https://www.webtoons.com/en/heartwarming/when-the-day-comes/list?title_no=2620,9.71,When the Day Comes,OMYO,"Norang and Paran are known at school to be the perfect couple -- minus the fact that they’ve already broken up. But unable to back out of a promise to participate in their school’s dance festival as their class’s representative couple, they decide to keep their split a secret, just until the competition is over. As the day of the festival -- and their “official” break-up -- approaches, the two begin to realize that ending their relationship may not be as simple as they thought.",Heartwarming,19,"475,114",178.6K,2,3,1134
85,https://www.webtoons.com/en/drama/fluidum/list?title_no=2283,9.12,Fluidum,GirlsOnFilm / ValeriaM,"Jesse was born like every citizen in the Fluidum universe, spending their first 20 years shifting seamlessly between a male and female body. Now with only one year left until they must choose one body for the rest of their life, Jesse is questioning the unquestionable... why decide at all?",Drama,44,1M,200.3K,0,5,875
86,https://www.webtoons.com/en/fantasy/crown-of-feathers/list?title_no=2126,9.23,Crown of Feathers,Nicki Pau Preto / Foxkirin,"In a world ruled by fierce warrior queens, a grand empire was built upon the backs of Phoenix Riders—legendary heroes who soared through the sky on wings of fire—until a war between two sisters ripped it all apart.
​
Sixteen years later, Veronyka is a war orphan who dreams of becoming a Phoenix Rider from the stories of old. After a shocking betrayal from her sister, Veronyka sets out alone to find the fabled Phoenix Riders—and will stop at nothing to join their ranks. ",Fantasy,47,"906,508",300.4K,0,1,308
87,https://www.webtoons.com/en/fantasy/dice/list?title_no=64,9.3,DICE,Hyunseok Yun,"Whether it's appearance, grades, or social life, Dongtae's at the bottom of the barrel. When popular transfer student Taebin gives him an opportunity to change all of that, Dongtae heads down a path to make things right. This is the world of DICE, where a single roll can change your fate.",Fantasy,375,9.5M,1.2M,0,1,434
88,https://www.webtoons.com/en/mystery/garden-club-detective-squad/list?title_no=2410,9.73,Garden Club Detective Squad,52chu,"Gardening and solving crime aren’t what straight-A student Yeon Han thought she would be focusing on at her new school. But when she discovers a notebook that contains clues to a 15-year-old murder mystery, she and the other members of her new gardening club realize the murderer not only has access to the school -- they probably work for the school. Can the gardening club squad figure out who committed the murder even though the principal and their teachers seem desperate to cover it up?",Mystery,32,"594,839",177.2K,0,3,980
89,https://www.webtoons.com/en/fantasy/the-masked-fables/list?title_no=2384,9.44,The Masked Fables,Ebae Kim,"With no memories and a mysterious illness consuming her, Ari must follow the clues of an old riddle that could possibly help her spirit friend Hadley recover his lost body. Little did they know, each riddle will lead them to a new kingdom full of familiar characters. As these fairy tales take a twisted turn, Ari's own story begins to unravel...",Fantasy,33,"391,318",149.2K,0,2,861
90,https://www.webtoons.com/en/slice-of-life/deadlove/list?title_no=2460,9.18,Deadlove,Guy / Teo,"They say you can’t run away from your problems... and Joel just learned that the hard way.

Talk about having cold feet! Joel is all set to marry Kim, his art school sweetheart, but in a moment of poor judgment he has an affair with his roommate Zoe. Hounded by the guilt, but unable to fess up to his fiancé, he decides the most responsible thing to do is... run away. As far and as fast as he can. He now finds himself selling cosmetics at a shopping mall in New Zealand. Sure, he is homesick, and everything is unfamiliar, but at least he can work through his issues in peace and quiet, right?

Wrong. Read this comic to find out how Joel’s plans fall apart, and how he puts himself back together, with the help of an unexpected guest...",Slice of life,28,"213,489",74K,0,3,154
91,https://www.webtoons.com/en/fantasy/elf-and-warrior/list?title_no=908,9.67,Elf & Warrior,AC Stuart / Victor Rosas II,"Elf & Warrior follows the adventures of a young, optimistic Elf named Basri and his Uncle Hector, a reformed (sort of) criminal in a unique fantasy setting full of strange monsters and magic.",Fantasy,237,2.1M,228K,0,3,287
92,https://www.webtoons.com/en/sf/bloodless-wars/list?title_no=1622,9.25,Bloodless Wars,Tovon,"If the bullets are virtual, then why does death feel so real? Questions like these are always front-of-mind on the front lines of the wars of the future, where virtual reality plays out in real time, and if you’re killed in action you can lose everything but your life. But for elite soldier Nick, and his team of hardened warriors, the stakes are even higher as they race against time to win a war with very real world consequences.",Sci-fi,92,"309,023",122.2K,0,1,168
93,https://www.webtoons.com/en/fantasy/soleil/list?title_no=1823,9.54,SOLEIL,YenKin,"Ever since her parent's funeral, Florette seems to only find solace in her flower shop and garden.
Her love for nature is tested when she meets a tiny plant prince from a miniature plant world. With the “invaders” threatening his plant kingdom, Florette finds her calling to help save the world and its people. Could it be her botanist skills, or is there a bigger connection between Florette and the Kingdom of Soleil?",Fantasy,70,"893,985",238.5K,0,3,630
94,https://www.webtoons.com/en/supernatural/the-world-where-i-belong/list?title_no=1318,9.59,The World Where I Belong,GMOW,A high school student's attempt to end his life is interrupted by a strange girl with even stranger powers.,Supernatural,71,"906,484",317K,0,1,1211
95,https://www.webtoons.com/en/sf/denma/list?title_no=921,8.95,Denma,Youngsoon Yang,"Dike the Invincible Death is the #1 target for bounty hunters across planet Urano. After getting drugged by a mysterious woman in a bar, Dike wakes up in the body of Denma, a 12-year-old space courier. With Denma's powers as a Quanx, he journeys across the galaxy fighting futuristic societies, flying spaceships, and foiling insidious plots, all to get his body back.",Sci-fi,1204,2.3M,79.2K,0,3,308
96,https://www.webtoons.com/en/comedy/unlucky-is-as-lucky-does/list?title_no=1554,9.68,Unlucky is as Lucky does,M. Nires,"An enemy from afar has threatened to kidnap the king’s daughter. The king springs into action seeking the most elite members of his kingdom to protect her. Sounds like your average everyday fantasy tale. Except that it isn’t… The king is overprotective, the queen can barely tolerate the king, the princess-in-distress is only 7 years old but is strong enough to beat up anyone in the kingdom, and the man or woman who must protect her?  He doesn’t have to be the strongest or the smartest…just the LUCKIEST person who ever lived. So yeah, what this tale lacks in tradition, it makes up for in sheer over-the-top lunacy!",Comedy,163,2.7M,238.8K,0,3,105
97,https://www.webtoons.com/en/super-hero/the-red-hook-blackout/list?title_no=2282,7.03,The Red Hook: Blackout,Dean Haspiel,"The Red Hook must combat his vigilante mother to destroy an Apocalypse Sword, only to rebirth the wrath of a villain who threatens to send New Brooklyn back to the stone age!",Superhero,26,"14,588",16.8K,3,5,161
98,https://www.webtoons.com/en/super-hero/outrage/list?title_no=1450,9.37,Outrage,Fabian Nicieza / Reilly Brown,A virus is attacking people who abuse others on the internet. Comedic ass-kickings are occurring across the country by a sentient electronic entity that appears through the personal devices of bullies and babies alike. Who or what is OUTRAGE?,Superhero,44,"611,130",220.5K,0,5,1882
99,https://www.webtoons.com/en/heartwarming/heart-anthology/list?title_no=2191,9.66,HEART Anthology,Marvin.W / caw-chan,"Featuring stories from the 2020 Short Story Contest!  From wholesome stories to tearjerkers, are you ready to catch these feelings? New stories released every Wednesday.",Heartwarming,97,1.5M,217.2K,0,3,186
100,https://www.webtoons.com/en/supernatural/soul-on-hold/list?title_no=1701,9.65,Soul on Hold,Austen Marie," Ayden seems to live a pretty normal life…normal that is except for the voice in his head haunting him 24/7. It takes meeting Maggie, the cute barista, to uncover the horrifying truth behind the madness. Together with Maggie, Ayden discovers that the voice in his head is actually a servant of a demonic force who collects souls once they've matured on their 30th year. With Ayden's birthday just around the corner, he and Maggie join forces to find an alternative to their fated demise.",Supernatural,58,1.2M,270.3K,0,5,1484
101,https://www.webtoons.com/en/sf/in-the-bleak-midwinter/list?title_no=1946,9.77,In the Bleak Midwinter;,Kat / Ali,"With a dead sister and 25 years to go on her soulmate timer, Anya decides to cryogenically sleep away her problems. Too bad she wakes up to an apocalypse full of them. Now stuck in a burnt out landscape full of killers, Anya must decide which she wants to keep: her heart or her head.
",Sci-fi,42,2.3M,573.8K,0,1,1932
102,https://www.webtoons.com/en/action/darbi/list?title_no=1098,9.53,Darbi,Sherard Jackson,The misadventures of a blood-thirsty baby T-Rex.,Action,137,2M,326.6K,0,4,1612
103,https://www.webtoons.com/en/drama/the-devil-is-a-handsome-man/list?title_no=1311,9.55,The Devil is a Handsome Man,Hellothisisangle,Xolia makes the deal with the devil in order to obtain her desires. But she soon finds that this deal is shrouded in more mystery than she could have imagined.,Drama,74,2.3M,752.6K,0,5,224
104,https://www.webtoons.com/en/comedy/mage-and-demon-queen/list?title_no=1438,9.78,Mage & Demon Queen,Color_LES,"Adventurers seek to take the demon queen’s head, but a love-struck young female mage wishes to take her hand. Join us won’t you, for this bawdy tale of love and persistence set inside a real-life RPG.",Comedy,134,17.3M,2.3M,0,2,917
105,https://www.webtoons.com/en/supernatural/unholy-blood/list?title_no=1262,9.85,Unholy Blood,Lina Im / Jeonghyeon Kim,"When vampires destroy her chance to have the normal life she’s always wanted, Hayan is forced to draw on her darkest secret to rid the world of the merciless hunters that took it over 10 years ago. With the support of a rising star in the local police force, Hayan steps up to protect her loved ones, face her past, and get her revenge.",Supernatural,76,9M,1.4M,0,2,147
106,https://www.webtoons.com/en/sports/the-boxer/list?title_no=2027,9.85,The Boxer,JH,You’ve got the raw talent. Or you’re the underdog. But do you have the heart? Do you have what it takes? Let’s see what you’re made of. The real fight starts now!,Sports,85,6.8M,1.1M,1,4,1547
