,url_list,rate,title,author,description,genre,max_ep,like_tot_sum,subscribe,num_of_webtoon,total_pic_type,duration(day)
0,https://www.webtoons.com/en/romance/subzero/list?title_no=1468,9.8,SubZero,Junepurrr,"What would you sacrifice to save your family?  How far would you go to protect your people? For Clove, the last princess of a near-extinct Dragon clan, the answer is the unthinkable:  MARRY your greatest sworn enemy in an effort to bring peace to your land.",Romance,103,16M,2.5M,0,1,196
1,https://www.webtoons.com/en/fantasy/the-first-night-with-the-duke/list?title_no=1267,9.64,The First Night With the Duke,MSG / Teava,"A handsome, selfish noble falls for a beautiful, kind commoner -- at least, that’s how the story’s supposed to go. When an average college student wakes up as Ripley, an extra in her favorite romance novel, she resolves to enjoy the luxuries of her character’s status while watching the novel's plot unfold from the sidelines. However, her plans are soon derailed when she finds herself in bed with no other than Duke Zeronis, the novel’s hero! Dodging the villainess’ schemes, the Duke’s advances, and her own feelings, can Ripley keep the story on track and survive beyond the first night?",Fantasy,48,5.2M,952.2K,0,2,1368
2,https://www.webtoons.com/en/romance/nice-to-meet-you/list?title_no=2066,9.83,Nice To Meet You,Wishroomness,"A ditsy university student Mew finds a lost student card. Instead of doing the sensible thing, Mew decides to let fate take the wheel and try something silly. Little did she know, she would be confronting the owner of the card, Daze who has some things to say about what she did. Did Mew make the biggest mistake of her life? or the best decision of her life? Follow these two adorable goofballs to find out!",Romance,43,5.1M,1.1M,0,2,833
3,https://www.webtoons.com/en/comedy/rooftops-and-roommates/list?title_no=2576,9.39,Rooftops & Roommates,Zaanart,"Jeb is an architecture major at university, rooming with his best friend Todd. There's just one problem... Jeb’s secretly a gargoyle! Between studying, partying, and a bad ghost problem, will Jeb be able to keep his true identity a secret?",Comedy,18,"961,486",332.8K,0,5,371
4,https://www.webtoons.com/en/horror/everything-is-fine/list?title_no=2578,9.72,Everything is Fine,Mike Birchall,"Sam and Maggie are a normal couple, in a normal house, in a normal neighborhood. There is nothing strange about their heads, their neighbors or their sweet little dog. Everything is Fine.",Horror,18,1M,388.8K,0,3,1043
5,https://www.webtoons.com/en/romance/to-love-your-enemy/list?title_no=2114,9.76,To Love Your Enemy,Jungyoon / Taegeon,"Having mastered the art of lying her way through life, Yeonhee Bae has vowed to leave her past behind and make a fresh start for herself by going to college at 24. But when she runs into someone who knows a secret from her past that could completely ruin her reputation, her hopes for a perfect life suddenly start to crumble. Amidst college gossip, crushes, and jealousy, can the two set aside their differences and embrace each other for who they really are?",Romance,86,10.3M,1.7M,0,2,693
6,https://www.webtoons.com/en/fantasy/tower-of-god/list?title_no=95,9.86,Tower of God,SIU,What do you desire? Money and wealth? Honor and pride? Authority and power? Revenge? Or something that transcends them all? Whatever you desire—it's here. ,Fantasy,496,42.9M,2.8M,0,1,112
7,https://www.webtoons.com/en/slice-of-life/my-giant-nerd-boyfriend/list?title_no=958,9.73,My Giant Nerd Boyfriend,fishball,"Having a boyfriend who's a full foot taller than you might seem adorable at first, but it usually just ends up causing a whole bunch of minor inconveniences. Follow Fishball as she navigates the Malaysian life with her 6'5"" geeky boyfriend.",Slice of life,618,49.1M,2.1M,0,5,252
8,https://www.webtoons.com/en/thriller/its-mine/list?title_no=2010,9.74,It's Mine,LuckS,"There’s nothing that Yohan Do doesn’t know about his crush, Dajeong. Where she sits in class, works after school... and even where she lives. But unable to approach her, he watches her every move from afar and will do anything to protect her. Anything.",Thriller,103,6.5M,1M,0,1,364
9,https://www.webtoons.com/en/romance/your-smile-is-a-trap/list?title_no=2052,9.79,Your Smile is a Trap,AENGO,"Ex-idol trainee Kiyu has lived his whole life adored by everyone for his good looks. But he dreams of ordinary high school life, so when he puts on glasses to blend in with his peers, he finds that making friends is a lot harder when you don’t have your looks to fall back on. Not to mention he’s also socially awkward, his new seatmate has a permanent scowl on her face, and his fans have tracked him down at his new school.",Romance,48,3.6M,743K,0,2,270
10,https://www.webtoons.com/en/tiptoon/webtoon-now/list?title_no=2025,9.27,WEBTOON Now,LOZOLZ / Wyatt the Cat,Get your WEBTOON news here!,Informative,140,1.8M,450.5K,0,0,931
11,https://www.webtoons.com/en/action/dungeons-and-artifacts/list?title_no=2575,9.54,Dungeons & Artifacts,Zerowater / UMKY,"A dungeon-guiding gig goes sideways for explorer Stetch Atelier when the prince who hired him tricks him into activating a fatal curse. But instead of staying dead, Stetch is resurrected by a sentient artifact that offers him a deal that may help him get his revenge. To hold up his end of the bargain, Stetch sets off on a long journey of raiding dungeons, slaying monsters, and making new enemies and friends along the way.",Action,19,"649,441",352.4K,0,1,84
12,https://www.webtoons.com/en/romance/the-doctors-are-out/list?title_no=1910,9.59,The Doctors are Out,Blau,"The beloved Dr. Matias Guevara tends to his patients in his little neighborhood health clinic, unaware that Dr. Fernando Guevera opened his new veterinary clinic right next door! With their patients confused and their tolerance running thin, the two grown men constantly bicker and compete! Will their similar names and professions cause their rivalry to go untreated, or will they heal each others broken hearts?!",Romance,66,3.3M,446.7K,0,1,147
13,https://www.webtoons.com/en/fantasy/spells-from-hell/list?title_no=2431,9.58,Spells From Hell,WmW / Silke Tara,"James Chao, a hard-working, straight-A college student, suddenly finds a bubbly, curious fox spirit summoned into his room. Scarlet’s appearance forces him to confront all the magic that exists in the world--something he’s avoided ever since he was little. Together, they discover secrets about themselves and the world they live in, a world which reveals itself to be less peaceful than it seems, a world where Heaven, Hell, and Earth are at war.",Fantasy,30,1.2M,401.4K,0,5,630
14,https://www.webtoons.com/en/romance/no-longer-a-heroine/list?title_no=1264,9.4,No Longer A Heroine!,Maenggi Ki,"Lisa Cheon used to be the nation’s favorite on-screen idol, but swiftly falls from grace after being framed as a drug addict. She is offered the opportunity to turn it all around by starring on a new TV show, but it won't be easy: her character’s love interest is her ex-boyfriend, and she’s too nervous to act without alcohol. Can Lisa regain what she has lost and face the demons of her past?",Romance,44,1.8M,392.8K,0,2,504
15,https://www.webtoons.com/en/romance/to-you-who-swallowed-a-star/list?title_no=2533,9.54,To You Who Swallowed a Star,ARI,"When Jiu Seo moves out of her childhood friend’s mansion and into a small one-bedroom apartment, she thinks her world is ending -- that is, until she meets Hajun and Hayul, the neglected children who live downstairs. When a scouting offer comes in for Hajun to join an idol survival program, Jiu encourages him to audition, completely unaware of how it will change the trajectory of her and everyone else’s lives forever.


",Romance,25,1.4M,316.2K,0,2,857
16,https://www.webtoons.com/en/sports/wind-breaker/list?title_no=372,9.88,Wind Breaker,Yongseok Jo,"Jay's the perfect student. He's got straight As and he's the student body president. But after being coerced into joining the school's biking team, the Hummingbird Crew, he discovers a whole new world outside of studying. What new adventures will he face outside the comfort of his textbooks?",Sports,345,8.8M,838.6K,0,4,539
17,https://www.webtoons.com/en/action/code-adam/list?title_no=1657,9.77,Code Adam,Atterozen,"They were trained as children to become super-soldiers. Human beings literally created in a lab to fight on the front lines of a bloody war. But when the war ends, what’s to be done with the human-weapons? The subject of brutal experiments, some choose to break free and search for a cure before their own powers consume them.",Action,72,2.9M,759.3K,0,1,175
18,https://www.webtoons.com/en/sf/room-of-swords/list?title_no=1261,9.8,Room of Swords,Toonimated,"The 34th time Gyrus wakes up in a world ruled by monsters, he still thinks it's his first! Little does he know, he's stuck in a loop until he can survive long enough to collect the treasured “boss sword” from the Boss of Monsters and unlock the mythical Room of Swords before he dies agai-– whoops, too late! Well, here’s to lucky thirty-five…",Sci-fi,158,5.2M,747K,0,5,140
19,https://www.webtoons.com/en/comedy/safely-endangered/list?title_no=352,9.56,Safely Endangered,Chris McCoy,Silly comics for silly people.,Comedy,697,19.1M,1M,1,3,826
20,https://www.webtoons.com/en/sports/the-build-up/list?title_no=2712,9.76,The Build Up,911,"Maru Kang was just an ordinary kid with ordinary interests, until one day his father forces him to watch a soccer game on TV, sparking an obsession with the sport. Filled with determination, he sets a new goal for himself -- to become an amazing soccer player! The only problem is, he has already been proclaimed the “King of the Losers” at his high school. Can Maru overcome the obstacles in his path and transform into a talented and successful soccer player?",Sports,16,"286,593",151.3K,0,1,441
21,https://www.webtoons.com/en/romance/marry-me/list?title_no=1951,9.76,Marry Me!,Miku Yuki,"Civil servant Sinn gets a huge surprise on his 29th birthday when he is chosen as the first subject of an experimental new law to marry someone he's never met. His marriage partner is Mari, a recluse who has yet to experience the small joys of life. Now the two must navigate their relationship as a married couple, all while proving -- or disproving -- that the law will benefit the greater good of society.",Romance,75,1.7M,259.5K,0,2,140
22,https://www.webtoons.com/en/drama/midnight-rain/list?title_no=1797,9.1,Midnight Rain,Pani," For work purposes, Noemi's family settled in the estate of one of the wealthiest families in the country. There she meets Blade, the hot-headed prince, and Soren, the illegitimate son. Enjoying simple days of innocence and love, Noemi's happy life quickly shatters into complete darkness. After tragedy, jealousy and betrayal, what will be waiting for Blade, Soren, and Noemi at the end of the road? Will love be able to save them?  ",Drama,72,1.3M,338.8K,0,2,756
23,https://www.webtoons.com/en/sf/if-ai-ruled-the-world/list?title_no=2605,9.63,If AI Ruled the World,POGO / HOOPA,"Welcome to a world where artificial intelligence can drive your car, look after you when you’re ill, and solve all of your problems. But all of this convenience comes at a price. AI can pose a threat when it no longer has humanity’s best interests at heart. Can humans learn to coexist with AI?",Sci-fi,19,"258,779",144.4K,0,1,336
24,https://www.webtoons.com/en/comedy/gecko-chan/list?title_no=2717,9.3,Gecko Chan,Meritxell Garcia,"Gecko Chan is a young monster with uncontrollable strength. After moving to a new city, Gecko will have to learn to fit in a city that wasn't prepared for his monstrous size.",Comedy,20,"174,796",74.9K,0,3,945
25,https://www.webtoons.com/en/comedy/dont-hate/list?title_no=1574,9.35,DON'T HATE,Pink_Alien,"After the devastation of WWIV, humans have become virtually extinct and left the rest of the animal kingdom for themselves. Several decades of evolution later, the animals have grown in both population and human-like intelligence. Bucky is the last human on earth, and not everyone is a fan of his human history. He faces constant harassment and discrimination from his animal classmates to which he dreams of eradicating. It's not until he saves an all-powerful killer whale that his simple act of kindness becomes an endless cycle of pandemonium. ",Comedy,249,4M,262.4K,0,5,487
26,https://www.webtoons.com/en/sports/plum/list?title_no=1605,9.57,Plum,samkimart," In a world much like our own, fruit stacking has become the world’s most popular sport…and a young boy named Plum will become that’s sport most beloved underdog. Plum’s journey begins at the gates of Apple Seed City, the living, breathing home of the beloved sport itself. Will he succeed? Can he overcome the odds? The answers can be found up in clouds, as our hero begins his quest to stack higher than anyone before him.",Sports,99,"725,630",112.5K,0,3,833
27,https://www.webtoons.com/en/fantasy/kubera/list?title_no=83,9.7,Kubera,Currygom,"When Kubera loses her entire village on her 16th birthday, her salvation comes in the form of the magician, Asha. Together they journey through a world of Gods and Suras, magicians and pure-bloods. Intent on solving the mystery behind her past, Kubera may also hold the key to changing the world.",Fantasy,480,3.2M,230.8K,0,2,161
28,https://www.webtoons.com/en/fantasy/trump/list?title_no=84,9.54,Trump,Chaeeun Lee,"On February 29th, children under the age of 14 are said to have their wishes granted on a day known as Melly Day. In a world where humans are said to be blessed by the gods, Hiasen has been granted the ability to manipulate mana in his dreams... but all he really wants is to see his mother again. When his wish is granted on Melly Day, the world as he knows it changes forever.",Fantasy,319,1.6M,349K,0,2,805
29,https://www.webtoons.com/en/comedy/cursed-princess-club/list?title_no=1537,9.8,Cursed Princess Club,LambCat,"Meet Gwendolyn – living proof that princesses don’t always have it all. See, although she lives in a castle and her father is the King, Gwendolyn isn’t like a movie princess, or even a fairly-tale princess. She’s got a big heart, but isn’t particularly attractive and doesn’t have a Disney-quality singing voice. But one night, she accidentally stumbles upon the twisted world of the Cursed Princess Club, and her life will never be the same.  Hexed and cast out, the ladies of the club are just the people Gwendolyn needs to show her that just because she doesn’t “fit the mold” does not mean she’s any less of a princess.",Comedy,114,15M,1.9M,0,2,147
30,https://www.webtoons.com/en/drama/the-four-of-them/list?title_no=1524,9.58,The Four of Them,Mai Hirschfeld_,"Getting crushed by your crush. Coming out to your parents. Learning that your sister is your biggest dating rival.  High school sure does have its share of twists, turns and moments of high drama. To get through it all with your smile and sanity intact, you’re going to need some friends. Really good friends.  Friends like Johnny, Mariel, Gaby and Martina who, one way or another, will find a way to get through their teenage years together.",Drama,104,5.8M,991K,0,2,1519
31,https://www.webtoons.com/en/drama/heirs-game/list?title_no=1445,9.73,Heir's Game,suspu,"When a new heir to the duchy of Belluna comes of age, there is held the Heir's Game: a brutal series of duels to determine the heir's bodyguard. When Theuden, the new heir, meets Isran, a quiet duelist with a mysterious past, their love will threaten to change everything.",Drama,128,3.5M,283.9K,1,5,1365
32,https://www.webtoons.com/en/fantasy/empyrea/list?title_no=1407,9.75,EMPYREA,OHKATES,"For centuries, twelve Guardians and the Knights who serve them have protected Mankind from the fearsome Keres, ancient creatures with a thirst for souls. However, a series of sudden and brutal attacks threatens the fragile peace between Realms. Now Hawk, a Knight who bows before no one, and Kira, a young inventor, find themselves in the eye of the storm and will have to rely on each other to navigate through decadent courts of intrigue and deceit...",Fantasy,65,2.7M,621.5K,0,4,375
33,https://www.webtoons.com/en/romance/edith/list?title_no=1536,9.71,Edith,Swansgarden,"Edith is not your typical heroine. She struggles with her confidence, her morals, and life in general by not only holding herself to high standards, but her men as well. Enter two less-than-perfect men: one who may be the Prince Charming she’s been waiting for to deliver a fairy tale ending, the other a brash reality check who does NOT believe in happily-ever-after.  What will Edith do? Will she sacrifice her standards? Or keep searching for that mythical white knight who may or may not exist in the first place? Funny, messy and sexy, Edith’s journey is relatable to anyone who’s ever left their heart on the battlefield of the dating world.",Romance,91,8.5M,1.2M,0,5,175
34,https://www.webtoons.com/en/horror/brain-anthology/list?title_no=2207,9.34,BRAIN Anthology,Various Artists,"Are you ready for BRAIN Anthology? From mind-bending stories, to disturbing tales of our most primal fears, this anthology is designed to make you think and keep you up at night! New stories released every Saturday. Featuring stories from the 2020 Short Story Contest.",Horror,74,"705,391",135K,0,5,280
35,https://www.webtoons.com/en/romance/letsplay/list?title_no=1218,9.63,Let's Play,Mongie,"She’s young, single and about to achieve her dream of creating incredible videogames. But then life throws her a one-two punch: a popular streamer gives her first game a scathing review. Even worse she finds out that same troublesome critic is now her new neighbor!  A funny, sexy and all-too-real story about gaming, memes and social anxiety. Come for the plot, stay for the doggo.",Romance,140,28.9M,4.1M,0,2,472
36,https://www.webtoons.com/en/romance/down-to-earth/list?title_no=1817,9.81,Down To Earth,Pookie Senpai,"Kade lives his average life alone and undisturbed... until a cute alien girl crashes into his backyard! By opening up his home, will this other worldly girl inadvertently open up his heart?",Romance,78,9.7M,2.1M,0,5,315
37,https://www.webtoons.com/en/slice-of-life/boyfriends/list?title_no=2616,9.46,Boyfriends.,refrainbow,A comic about getting yourself a boyfriend... or multiple boyfriends! Four college students begin a polyamorous relationship and navigate the adventure that is their dating life!,Slice of life,50,6.6M,1.1M,0,2,329
38,https://www.webtoons.com/en/thriller/my-deepest-secret/list?title_no=1580,9.7,My Deepest Secret,Hanza Art,"Having a handsome, kind and caring boyfriend like Elios means the world to Emma. Even a look at him makes her heart flutters. But little does she know about a secret lies deep in their relationship. What is the said secret? ",Thriller,90,12.6M,2.4M,0,2,2586
39,https://www.webtoons.com/en/action/the-advanced-player-of-the-tutorial-tower/list?title_no=2409,9.55,The Advanced Player of the Tutorial Tower,Bangguseok Gimssi / Omagam,"After being trapped for 12 years in a tower full of regenerating monsters, Hyeonu Kim is more powerful than just about any human or monster on Earth. Now that he’s free, he’s determined to find out who was behind his imprisonment, even if that means he has to kill hordes of monsters -- and inadvertently save the world -- along the way.",Action,32,2.5M,919.8K,0,2,721
40,https://www.webtoons.com/en/romance/the-makeup-remover/list?title_no=2186,9.7,The Makeup Remover,Lee Yone,"After years of being told to focus on studying, Yeseul feels lost when she starts college and is suddenly expected to pay attention to makeup. When a chance encounter with brilliant makeup artist Yuseong leads to her taking part in a televised makeup competition, Yeseul begins to question the role that makeup and appearance play in society.",Romance,87,8M,1M,1,2,259
41,https://www.webtoons.com/en/drama/acception/list?title_no=1513,9.08,Acception,Colourbee,"With his rainbow-colored hair and love of all things fashion, Arcus is anything BUT your average teenager.  He’s an upbeat independent thinker, proud fashionista, and like the rest of us, is just looking for a few friends to call his own.  
Acception may be Arcus’ story – but it’s all OUR stories too - and it is for anyone who’s ever struggled to fit in, find love, or thought that High School was pretty much the worst thing ever invented.",Drama,168,9.5M,729K,0,3,350
42,https://www.webtoons.com/en/action/eleceed/list?title_no=1571,9.93,Eleceed,Jeho Son / ZHENA,"Jiwoo is a kind-hearted young man who harnesses the lightning quick reflexes of a cat to secretly make the world a better place – one saved little child or foster pet at a time. Kayden is a secret agent on the run, who finds himself stuck in the body of a…um…decidedly fat old fluffy cat.  Together, armed with Jiwoo’s super powers and Kayden’s uber-smarts, they’re out to fight those forces who would let evil rule this world.  That is, if they can stand each other long enough to get the job done.",Action,120,9.3M,900.9K,0,2,1239
43,https://www.webtoons.com/en/mystery/purple-hyacinth/list?title_no=1621,9.9,Purple Hyacinth,Ephemerys / Sophism,"Her ability to detect lies has made her an outstanding officer of the law – despite being haunted by her inability to save the ones she loved from a gruesome fate many years ago. Now, she uses her powerful gift to defend the defenseless at any cost – even if it means teaming up with a deadly assassin to fight evil in a world gone mad.",Mystery,106,9.1M,1.2M,0,2,182
44,https://www.webtoons.com/en/fantasy/the-wrath-and-the-dawn/list?title_no=1772,9.55,The Wrath & the Dawn,Renée Ahdieh / SilvesterVitale,"Khalid, the Caliph, takes a new bride each night only to have her executed at sunrise. So it is a suspicious surprise when Shahrzad volunteers to marry Khalid. However, Shahrzad has a clever plan - not only to stay alive - but to end the murderous King's reign of terror once and for all.

(A reimagining of 1001 Nights based on the YA novel by Renee Ahdieh.)",Fantasy,82,4.3M,988.5K,0,5,105
45,https://www.webtoons.com/en/drama/odd-girl-out/list?title_no=1420,9.84,Odd Girl Out,Morangji,"After a successful winter break makeover, Nari is finally ready for her high school debut. But somehow, she ends up friends with the three prettiest girls in school! Follow Nari as she tries to navigate her brand new high school life surrounded by beauties.",Drama,269,15.3M,774.9K,0,2,602
46,https://www.webtoons.com/en/romance/seasonsofblossom/list?title_no=2509,9.86,Seasons of Blossom,HONGDUCK / NEMONE,"Oh, to be young and in love. Oh, to be wild and carefree. The springtime of life is intense, tumultuous, and at times, oh so confusing. Spring, summer, fall and winter -- love blossoms in all seasons.
",Romance,41,2.6M,541.2K,0,2,707
47,https://www.webtoons.com/en/fantasy/winter-moon/list?title_no=1093,9.42,Winter Moon,Merryweather / MAYUI,A gay sorceror and a seductive priestess cross paths in an Online RPG.,Fantasy,429,29.7M,1.7M,0,2,504
48,https://www.webtoons.com/en/comedy/not-so-shoujo-love-story/list?title_no=2189,9.63,Not So Shoujo Love Story,Curryuku,"Romance-super-fan Rei Chan is ready for her first boyfriend and she knows just who it'll be: the most handsome boy in school, Hansum Ochinchin. But her plans for the perfect love story are derailed when the most popular girl in class declares herself a rival....for Rei's heart?! This is the year her not so shoujo love story begins!",Comedy,49,2.7M,530.4K,0,2,1687
49,https://www.webtoons.com/en/romance/romance-101/list?title_no=2406,9.81,Romance 101,Namsoo,"Bareum’s planner might be full, but one thing she desperately needs in her diary is a date. When she is lured into joining a programming club by her friend’s hot coworker, it looks like there might be hope for her. But will her inexperience lead to her downfall? And why does she keep running into his bad-tempered friend instead?
",Romance,56,2.7M,397.4K,0,2,294
50,https://www.webtoons.com/en/comedy/adventures-of-god/list?title_no=853,9.44,Adventures of God,Teo / Corey,"In this slice of (eternal) life, you'll meet God, visit Heaven and learn that what goes on behind the pearly gates isn't exactly the way the good book describes it.  For starters, it's a pretty unhealthy work environment - what with God's ginormous, fragile ego and heavy drinking problem. The good news is that while heaven is a lot less holy than expected, it's much more hilarious too.",Comedy,469,23M,1.4M,0,3,2170
51,https://www.webtoons.com/en/action/viral-hit/list?title_no=2268,9.83,Viral Hit,Taejun Pak / Kim Junghyun,"Scrawny high school student Hobin Yoo is probably the last guy you’d expect to star in a NewTube channel that revolves around fighting. But after following some advice from a mysterious NewTube channel, Hobin is soon knocking out guys stronger than him and raking in more money than he could have ever dreamed of. Can Hobin keep this up, or will he eventually meet his match?",Action,70,2.1M,361.3K,0,1,1302
52,https://www.webtoons.com/en/slice-of-life/murrz/list?title_no=1281,9.66,Murrz,Murrz,"Come along with Murrz and her ridiculous life full of jokes, cats, school, and learning to navigate the 21st century.",Slice of life,544,19.9M,771.2K,0,3,158
53,https://www.webtoons.com/en/comedy/live-with-yourself/list?title_no=919,9.76,Live with Yourself!,Shen / David Mercier,"An explosive time-space accident leaves happy-go-lucky 20-something Todd living with himself, himself, and himself. You get to watch the struggle.",Comedy,297,9.4M,607.9K,0,3,770
