,url_list,rate,title,author,description,genre,max_ep,like_tot_sum,subscribe,num_of_webtoon,total_pic_type,duration(day)
159,https://www.webtoons.com/en/supernatural/killmax/list?title_no=1894,9.1,KILLMAX,Kennycomics(Paul Jun) / SilentMaru,"Born into a bloodline of witches, Max is forced into a life on the run from the witch hunters. But when she unknowingly finds a way to use her magic, her life changes into something she could have ever imagined. ",Supernatural,28,1M,545.8K,0,1,189
160,https://www.webtoons.com/en/comedy/trailer-park-warlock/list?title_no=1512,9.29,Trailer Park Warlock,Matthew J. Rainwater,"Jake Baker, the working class warlock, struggles to make ends meet. But with the help of his friends and some down-home DIY magick, he might just keep chaos at bay, and pay his lot fees too...",Comedy,94,"535,219",94.1K,0,3,756
161,https://www.webtoons.com/en/romance/choco-latte/list?title_no=1691,9.76,Choco Latte,Ann,"Join high schoolers Kyle and Lilly as they discover hope, joy, and love in the simplicities of everyday life. Sweet and heartwarming, just like a chocolate latte, their love story proves that actions speak louder than words.",Romance,61,3.5M,639.5K,1,2,322
162,https://www.webtoons.com/en/comedy/love-advice/list?title_no=1498,9.81,Love Advice from the Great Duke of Hell,unfins,"The girl of your dreams barely knows you exist. Your friends can’t help. Your family is clueless. So where do you turn for love advice? Who can provide you with that essential assistance for the lovelorn?  If you’re average everyday teenager Paul, you summon a powerful demon from deep in the recesses of Hell and frankly, hope for the best.  ",Comedy,103,9.2M,1.1M,0,1,644
163,https://www.webtoons.com/en/drama/version-day-and-night/list?title_no=1796,9.53,Version Day and Night,dewkneelight,"Candy always dreamed of something more exciting than her secret double life. Sure, there’re her illicit nighttime meetings with Shun, the handsome class president with a double life of his own, but what good are cloaks without a little dagger? Lucky (or unlucky) for her, the new transfer student Jean is here to shake things up, and he just found out about Candy and Shun’s covert hobby. Can the pair keep themselves out of trouble, or will the covers get ripped off their private lives?",Drama,24,1.1M,474.7K,0,2,1323
164,https://www.webtoons.com/en/supernatural/third-shift-society/list?title_no=1703,9.78,Third Shift Society,Meredith Moriarty,"Life’s funny.  One minute you're jobless, deep in debt and on the verge of eviction; the next you’re in a fight with a monster and getting a job working for a Paranormal Detective with the head of a Jack-o-Lantern. It’s an age-old story. Now the financially-challenged Ellie (who’s just discovered she has strong psychic powers) and her Pumpkin-headed boss Ichabod have to team up and fight the things that go bump in the night.",Supernatural,24,"857,725",374.5K,0,1,175
165,https://www.webtoons.com/en/drama/blessed/list?title_no=1193,9.2,#Blessed,M. Victoria Robado,"Joanna is a mid-twenties office girl who likes social media and watered down coffee. While griping about her love life, she accidentally swiped right on a whole Pantheon of Gods and Goddesses! Looking to fulfill an ancient prophecy, only one of them will be able to claim Joanna as their own... after a nice dinner, that is!  ",Drama,64,1.7M,425.1K,0,3,385
166,https://www.webtoons.com/en/romance/midnight-poppy-land/list?title_no=1798,9.81,Midnight Poppy Land,Lilydusk,"After making a grisly discovery in the countryside, a small town book editor’s life gets entangled with a young Mafia lord and his intimidating bodyguard...even as every step she takes draws her deeper into the dangerous underworld of the city.",Romance,69,9.6M,2M,0,2,287
167,https://www.webtoons.com/en/fantasy/men-of-the-harem/list?title_no=2443,9.71,Men of the Harem,HereLee / Alphatart,"Scorned by her lover and thrown into power after the mysterious assassination of her father, Latil must marry to secure her sovereignty of Tarium. Instead of choosing one man to become her Royal Consort, she chooses five young men from all walks of life to join her Harem. Will Latil ever solve her father’s murder, and can she keep the peace in her Harem?",Fantasy,29,3.3M,990.6K,0,2,203
168,https://www.webtoons.com/en/fantasy/like-wind-on-a-dry-branch/list?title_no=2405,9.78,Like Wind on a Dry Branch,Dalsaeowl / Hwaeum,"As plague and turmoil afflicts the empire, enchanting widow Rieta Tristi finds herself at the mercy of a malicious nobleman and his dying wish to have her buried alive beside his corpse. The plague has taken her husband, slave traders have taken her young child, and now her own life is at risk -- until an unexpected visit from the empire's outcast prince changes everything.",Fantasy,31,2.9M,955.1K,0,2,231
169,https://www.webtoons.com/en/fantasy/your-throne/list?title_no=2009,9.81,Your Throne,SAM,"Tensions are brewing under the seemingly calm surface of the Vasilios Empire, a kingdom ruled by the Imperial Family and the Temple. Lady Medea Solon has lost her place next to Crown Prince Eros, but resolves to do whatever it will take to win back what's rightfully hers. Will she reclaim her throne?",Fantasy,79,7.6M,1.2M,0,2,1575
170,https://www.webtoons.com/en/action/the-strongest-florist/list?title_no=2507,9.85,The Strongest Florist,Hyun hoo Joo / Kumtata,"Even though he’s built like a fighter with a fearsome scowl, Jaeho would love nothing more than to become a florist instead. Unfortunately, Jaeho’s overbearing father disapproves, pushing his son to become an MMA fighter instead. Jaeho enters the virtual reality game, New World, to escape his father’s ambitions, but will he be able to realize his dreams?
",Action,23,1.4M,426.3K,0,1,966
171,https://www.webtoons.com/en/action/return-to-player/list?title_no=2574,9.66,Return to Player,UMKY / SEHON,"Ten years ago, a group of gods turned everyone on Earth into players of a sadistic game that forced them to kill monsters in real life -- or be killed themselves. Sehan Kim has already seen how this game will play out: everyone in the world dies except for him. When he’s given the chance to go back in time and start a second playthrough, Sehan is determined to change the course of events and beat the gods at their own game.",Action,19,"731,115",389.4K,0,1,1722
172,https://www.webtoons.com/en/romance/death-of-a-pop-star/list?title_no=2273,9.35,Death of a Pop Star,Violet Karim,"Number one on the pop charts and in the hearts of fans world-wide, Sophie Lim is at the top of her game -- until she takes a tumble from the top of the stairs. Now she's dead, and it turns out it's harder to build a career from six feet under. But lucky for her, the Grim Reaper's her number one fan!",Romance,44,2.1M,538.7K,0,2,1036
173,https://www.webtoons.com/en/supernatural/devilish-romance/list?title_no=2529,9.45,Devilish Romance,Lee Kong-joo / White Eagle,"After being unfairly framed in devildom, middle-tier devil Sitri falls onto Earth as a human and searches for a serial killer who could take him back to his origin. He meets a stubborn, strict human boss who he initially hates; however, he eventually starts having feelings for her. Love has no limits, but... does it really? What will be their fate?",Supernatural,23,"852,126",342.8K,0,2,108
174,https://www.webtoons.com/en/fantasy/the-croaking/list?title_no=1494,9.79,The Croaking,echorise,"The Roost - the world’s most prestigious military academy - has never accepted a Crow into its ranks. Until now. However, the conditions surrounding Scra’s acceptance are shrouded in conspiracy, and his new roommate Ky won’t rest until he finds out just where he goes every night. Between flight tests, classes, and Murders, Scra, Ky and Ree must band together to uncover the truth about their utopia and the whispers of a superweapon - “The Croaking” - that are seeping from the cracks.",Fantasy,128,4.8M,546.4K,1,4,406
175,https://www.webtoons.com/en/fantasy/how-to-become-a-dragon/list?title_no=1973,9.76,How to Become a Dragon,eon,"What should you do when a 1000-year-old imoogi named Bari suddenly appears in your apartment and demands you pay for the sins of your ancestors? Help him become a dragon, of course! Young Yoo's life is on the line as he teaches Bari the ins and outs of getting along with humans in order to prepare for the Nakdong River Dragon Exam. Will Young be able to help Bari pass the exam and become a full-fledged dragon?",Fantasy,71,2.5M,451.1K,1,2,791
176,https://www.webtoons.com/en/fantasy/lone/list?title_no=1929,9.72,Lone,Mel0h,"Born without magic in a world full of witches, Lone is determined to claw her way to the top of wizarding school if it kills her -- and it just well might! After a deal with the devil improves her magical aptitude and leaves her with a parasitic demon lord stuck to her forehead, Lone's dream is finally within reach. Now she just has to survive long enough to graduate high school...and help Lord Beelxaroth retake his rightful throne as King of Hell so that he'll finally get out of her hair.",Fantasy,58,1.4M,315.2K,0,3,695
177,https://www.webtoons.com/en/super-hero/urban-animal/list?title_no=1483,9.71,Urban Animal,Justin Jordan / John Amor,"Meet Joe Gomez.  He’s got high school on lock – good grades, a cool band, and girls digging his vibe. But just when he’s got the world figured out, he goes and turns into a saber-toothed tiger.  A shape-shifting nature spirit known as a Chimera, to be specific.  Now Joe needs every single one of his new powers to help save the human race – whether he wants to or not.",Superhero,101,2.3M,510.3K,0,5,840
178,https://www.webtoons.com/en/historical/the-snake-and-the-flower/list?title_no=2619,9.72,The Snake and the Flower,Na-eum So,"Long ago, an emperor suddenly decided to execute the members of his court. Only after being offered a girl named Aehwa, did the emperor’s rampage stop. The emperor cherishes his “flower” dearly. When Aehwa expresses an interest in music, the Emperor makes Harang Kang her personal court musician. However, the emperor decreed that only he can lay eyes on Aehwa and has Harang’s eyes destroyed. After finding out the true cause of his father’s death, Harang swears revenge on both Aehwa and the Emperor. In this twisted realm of snakes and flowers, who will prevail?",Historical,19,"410,577",201.6K,0,1,973
179,https://www.webtoons.com/en/fantasy/the-wendybird/list?title_no=2546,9.06,The Wendybird,WmW / Thabfu,"Wendy Darling is a headstrong 17-year-old who dreams of escaping her humdrum life and strict family for a life of adventure, like the heroes in her stories. But what will she do when adventure actually comes knocking? In this retelling of Peter Pan, it’s Wendy who must save Neverland from Captain Hook and the strange beasts that torment its inhabitants.",Fantasy,22,"403,428",161.2K,0,1,772
180,https://www.webtoons.com/en/comedy/bad-signs/list?title_no=1623,9.57,Bad Signs,Jimena Aranda,"The pilots fudged their flight-checks and the plane engine's probably going to blow, but what else can you expect when Mercury is in retrograde? So much for the paradisiacal vacation these twelve contestants signed up for. Now all twelve members of the zodiac are trapped on a real desert island with nothing to eat but each other and some monkeys. Who will win? Who will survive? Only the stars know for sure.",Comedy,75,1.4M,249.4K,0,3,784
181,https://www.webtoons.com/en/drama/random-chat/list?title_no=1669,9.62,Random Chat,Eun Hyuk Park,"If you lived through – or are still living through – high school, you can relate to Joon-Woo.  An outcast and a loner, his only joy comes from the hours he spends on his phone, randomly chatting with strangers.  It’s all weird and meaningless, until Joon-Woo strikes gold – as he’s matched in a private chat with a pretty young girl his age. Jackpot!  But when he discovers that this same pretty girl is actually his classmate Seung Ah, things get a little too real for a guy who’s never even remotely been kissed.",Drama,110,2M,306.4K,0,1,553
182,https://www.webtoons.com/en/thriller/shiloh/list?title_no=1649,9.62,Shiloh,Kit Trace / Kate Flynn,"The Marked Man has struck again, and rookie officer Callahan and her partner are the first on the scene of his latest grisly murder. The investigation quickly takes them into the dangerous depths of Shiloh, where more than just their suspect might be hiding in wait.",Thriller,90,1.5M,358.2K,0,5,101
183,https://www.webtoons.com/en/horror/witch-creek-road/list?title_no=1453,9.38,Witch Creek Road,Garth the Geek / Kenan Halilovic,"A survival horror about love, acceptance, death and revenge. And sexy flesh-eating demons. Yeah, it has those, too.",Horror,80,1.4M,439.5K,0,4,1400
184,https://www.webtoons.com/en/mystery/dr-frost/list?title_no=371,9.8,Dr. Frost,JongBeom Lee,"College professor by day, and bartender by night, psychologist Dr. Frost believes in one simple belief. Humans are all the same. He uses this tenet to guide his practice, and solves the puzzles of the human mind one by one.",Mystery,159,2.3M,373.1K,0,1,238
185,https://www.webtoons.com/en/mystery/locker-opener/list?title_no=2515,9.53,Locker & Opener,Manchi / Barunflower,"There’s no lock Detective Dobin Kim can’t open. With his unique ‘opening’ ability, he can unlock anything -- even people -- to get the information he needs to hunt down criminals and solve crimes. Enter Locker -- his polar opposite and his enemy. When Locker uses her ability to ‘lock’ a witness and prevents Kim from accessing key information in a crucial case, they plunge into a cat-and-mouse game with justice itself at stake. When two equal forces collide, who will emerge the victor?",Mystery,24,"277,440",149K,0,2,133
186,https://www.webtoons.com/en/supernatural/fluffy-boyfriend/list?title_no=1164,9.14,Fluffy Boyfriend,Mihi,"A cursed girl's life changes forever when her cat, who lived with her quietly for a long time, shows her his real human form. Fluffy Boyfriend is a love story in a world of half-animal humans secretly living in plain sight.",Supernatural,147,4.6M,1.3M,0,2,280
187,https://www.webtoons.com/en/sf/ghost-bats/list?title_no=2348,9.18,Ghost Bats,Walter Ostlie,"Ghost Bats, a semi-decent punk band, is suddenly thrust into a galactic Battle of the Bands to defeat their rivals....while conjuring giant monsters?! Can the band survive their interplanetary star trek and win the Grand Prize or will this be their final encore?",Sci-fi,38,"94,806",53.7K,1,3,2586
188,https://www.webtoons.com/en/sf/guardians-of-the-video-game/list?title_no=368,9.09,Guardians of the Video Game,Gasfard,"Within the wires and pixels of your favorite video game lies an unsuspecting protector. Patch is the top guardi-agent at the Guardians of the Video Game Corporation, working hard to keep games running at all costs. That is, until his promotion is ruined by office politics and he's assigned to the obsolete Classic Games department. Nevertheless, Patch is determined to fulfill his responsibilities as a guardian.",Sci-fi,231,"387,798",56.4K,0,3,140
189,https://www.webtoons.com/en/fantasy/deor/list?title_no=1663,9.69,Deor,J.oori,"The young prince, Deor, is an outcast in his own land. Born without the ability to use magius – a rare condition that marks him as an incompetent –  he relies on his intelligence and tenacity to prove wrong those who believe he is not fit for the crown. However, with deadly demons and conspiracies threatening the very existence of humanity, Deor must protect the very kingdom which ridiculed him. Will he be able to defeat the demons and secure his position as king?",Fantasy,49,2.1M,831.7K,0,1,315
190,https://www.webtoons.com/en/romance/the-kiss-bet/list?title_no=1617,9.69,The Kiss Bet,Ingrid Ochoa,"It’s senior year and Sara Lin just turned 18. She’s got great friends, a cool Dad (or so he thinks) and a whole lot ahead of her. The last thing she needs is to worry about having her first kiss. But that’s all about to change because her good pal Patrick just challenged her to a bet that will either lead to love, heartbreak or embarrassment…or maybe all three.",Romance,82,6.7M,1.1M,0,3,105
191,https://www.webtoons.com/en/romance/cinnamonroll/list?title_no=2226,8.81,CinnamonRoll,RE ME,She's cold as ice. Can he melt her heart? ❄️,Romance,37,"710,231",290.1K,0,2,1008
192,https://www.webtoons.com/en/thriller/killstagram/list?title_no=1971,9.28,#Killstagram,Ryoung,"Remi Do has everything -- she's super pretty, has the best brand sponsorships on social media, and gets 10,000 likes within seconds of posting a selfie. Oh, and she also has a serial-killing stalker following her every move.",Thriller,44,3.2M,807.4K,0,3,203
193,https://www.webtoons.com/en/horror/uriah/list?title_no=1607,9.8,Uriah,Toffuo, A rainy night. A mysterious island. A boy with a dangerous story to tell – if only he could remember who or where he was. So begins a chilling journey into the unknown – when uncovering a twisted world of secrets is the only way to survive.,Horror,72,2M,387.7K,0,1,1432
194,https://www.webtoons.com/en/romance/lore-olympus/list?title_no=1320,9.72,Lore Olympus,Rachel Smythe,"Witness what the gods do…after dark. The friendships and the lies, the gossip and the wild parties, and of course, forbidden love. Because it turns out, the gods aren’t so different from us after all, especially when it comes to their problems. Stylish and immersive, this is one of mythology’s greatest stories -- The Taking of Persephone -- as it’s never been told before.",Romance,173,40.5M,5.1M,0,3,840
195,https://www.webtoons.com/en/fantasy/the-remarried-empress/list?title_no=2135,9.87,The Remarried Empress,Alphatart / Sumpul,"Navier Ellie Trovi was an empress perfect in every way -- intelligent, courageous, and socially adept. She was kind to her subjects and devoted to her husband. Navier was perfectly content to live the rest of her days as the wise empress of the Eastern Empire. That is, until her husband brought home a mistress and demanded a divorce. “I accept this divorce… And I request an approval of my remarriage.” In a shocking twist, Navier remarries another emperor and retains her title and childhood dream as empress. But just how did everything unfold?
",Fantasy,85,14.5M,1.9M,0,2,987
196,https://www.webtoons.com/en/romance/my-gently-raised-beast/list?title_no=2606,9.85,My Gently Raised Beast,Yeoseulki / Early Flower,"Blondina is living a real-life Cinderella story. After growing up poor and enduring a difficult childhood, she discovers that she is a princess of the Ates empire. However, her estranged father and half-siblings give her the cold shoulder when she moves into the palace, and Blondina must keep a low profile. That all changes when she befriends Amon, a cat-like creature with mysterious intentions. For years, creatures like Amon and humans have struggled to live in harmony. Can Blondina and Amon’s friendship bring peace, or will it deepen the rift between their people?",Romance,18,1.6M,726K,0,2,686
197,https://www.webtoons.com/en/fantasy/castle-swimmer/list?title_no=1499,9.84,Castle Swimmer,Wendy Lian Martin,"What happens when your entire life is ruled by a prophecy – your future foretold by people you’ve never met, who died long before you were born.  Such is the story of two young sea creatures.  One believed to be a guiding light for his people, a Beacon who will lead them to a bright, prosperous future.  The other is a teenage prince for who’s destiny is to KILL the Beacon so that HIS own people might thrive.  When both reject the course set for them, it leads to a raucous adventure as big and unpredictable as the ocean itself – and a romance that nobody could have predicted.",Fantasy,106,14.2M,2.1M,0,1,259
198,https://www.webtoons.com/en/fantasy/lumine/list?title_no=1022,9.83,LUMINE,Emma Krogell,"A runaway werewolf, Lumine, meets a witch boy named Kody and is being hired to work as his bodyguard. Lumine, being determined to befriend Kody, tries everything to get Kody to trust him, while Kody tries to keep Lumine away from him. Their life gets even more complicated after an unfortunate event that leaves them to try to survive on their own.",Fantasy,144,18.4M,2.9M,0,3,1118
199,https://www.webtoons.com/en/thriller/not-even-bones/list?title_no=1756,9.71,Not Even Bones,R Schaeffer / Glamist,"Nita doesn’t hunt supernatural beings and sell their body parts on the black market – her mother does that. Nita only dissects the magical bodies for her mother. However, Nita's about to get a real taste of the family business and there is no turning back.
Now, Nita must decide whether she is willing to become a monster...

(Based on the YA novel by Rebecca Schaeffer.)",Thriller,69,6.5M,1.5M,0,5,210
200,https://www.webtoons.com/en/supernatural/jacksons-diary/list?title_no=2446,9.65,Jackson's Diary,Paola Batalla,"The year is 1989, and Jackson is starting his senior year at a brand new school. Even though he's back in his hometown with his new family, he can't seem to shake this ominous and uneasy feeling invading his mind. It's not until he meets the popular kid, Exer, that reality starts to feel more like the work of his imagination.",Supernatural,30,2.3M,582.7K,0,5,105
201,https://www.webtoons.com/en/supernatural/im-the-grim-reaper/list?title_no=1697,9.8,I'm the Grim Reaper,GRAVEWEAVER,"On earth there are bad people, and then there are REALLY BAD people. If you’re one of the latter, you don’t just get sent to Hell, you get sent to Hell and get assigned a job collecting the souls of some of the worst people on Earth. Such is the career path of a young woman named Scarlet, who dies and is delivered down to the fiery underworld only to find herself in an entry level position as…The Grim Reaper!",Supernatural,86,7.4M,1.5M,0,1,532
202,https://www.webtoons.com/en/romance/the-newlywed-diary-of-a-witch-and-a-dragon/list?title_no=2448,9.31,The Newlywed Diary of a Witch and a Dragon,New lung / Dimang,"After spending the night with a recent hire of the Tower of Magic, Wendy Blanchett, a talented young leader of the Rune Research Division, is faced with an impossible dilemma. She fears for her position and reputation when the newbie, Aiden Winters, asks her to marry him. Unbeknownst to Wendy, Aiden seems to have secrets of his own. Will their love blossom, or will his secrets tear them apart?
",Romance,29,2M,645.7K,0,2,294
203,https://www.webtoons.com/en/romance/blades-of-furry/list?title_no=2383,9.61,Blades of Furry,Deya Muniz / Emily Erdos,"Emile is an up-and-coming skater in the beloved sport of Skate Battles, a high-stakes combo of figure skating and martial arts. Radu is a well-known senior skater and several time champ with the world at his feet. However, during an ill-fated match between the two, Emile discovers Radu's secret, which could threaten to destroy him. Will Emile keep his secret? Or could this rivalry turn into something more...?",Romance,33,1.6M,376.3K,0,3,105
204,https://www.webtoons.com/en/drama/lookism/list?title_no=1049,9.79,Lookism,Taejun Pak,"Daniel is an unattractive loner who wakes up in a different body. Now tall, handsome, and cooler than ever in his new form, Daniel aims to achieve everything he couldn't before. How far will he go to keep his body... and his secrets?",Drama,346,32.7M,2.1M,0,2,2408
205,https://www.webtoons.com/en/romance/before-we-knew-it/list?title_no=1972,8.85,Before We Knew It,Nakano Mayaka,"A stranger to love, Kano's only romantic experience lies in novels.  Her love of books has driven her to pursue a career in editing.  When she's assigned to work with playboy best-selling author Kagaya, she becomes determined to succeed despite their ever-complicating relationship!",Romance,71,3.3M,697.6K,0,2,105
206,https://www.webtoons.com/en/sf/lovebot/list?title_no=2324,9.38,LoveBot,Chase Keels / Miranda Mundt,"In 2049, highly advanced and affectionate robots are becoming humanity's primary companions in place of real relationships. Xada makes his living by modifying these bots to fit their owners specific wants and needs. However, his newest job leaves the LoveBot strangely sentient, and asking for his help... Sparks will fly as Xada relearns human connection and helps uncover the truths behind the LoveBots' existence.",Sci-fi,40,1.2M,283.5K,0,5,245
207,https://www.webtoons.com/en/action/blood-ink/list?title_no=1490,9.68,Blood-Ink,Lupicut,"In the Republic of Terragua, being an assassin is not only legal, but quite profitable if you play your cards right. It’s as simple as accepting a Blood-Ink, taking out the target, and getting paid. As long as you follow the rules and pay your taxes on time, there shouldn't be any problem at all. At least, that's what Maya thought until she met Rama, an unlicensed assassin with a thirst for vengeance…",Action,114,4.2M,634.2K,0,5,889
208,https://www.webtoons.com/en/supernatural/mystical/list?title_no=2128,9.82,Mystical,VAN.J,"Garam has always loved to draw, but his dreams of being an artist have been on hold ever since his mother passed away. Wanting to become more independent and focus on his art, he moves into his grandmother's empty house by the ocean. There, he meets his greatest muse: a mystical water creature with no memories of her past. Now it’s up to Garam to help her uncover what she has forgotten.",Supernatural,53,1.9M,526.6K,0,2,112
